{
  "pack_version": 1,
  "pack_type": "cross_source_node_projection",
  "source_manifest_ref": "mechanics/boundary-bridge/parts/cross-source-projection/manifests/cross_source_node_projection.json",
  "source_inputs": [
    {
      "name": "aoa_techniques_kag_export",
      "repo": "aoa-techniques",
      "role": "primary_export",
      "ref": "aoa-techniques/generated/kag_export.min.json"
    },
    {
      "name": "tos_kag_export",
      "repo": "Tree-of-Sophia",
      "role": "supporting_export",
      "ref": "Tree-of-Sophia/ToS/derived-exports/kag_export.min.json"
    },
    {
      "name": "tos_retrieval_axis_pack",
      "repo": "aoa-kag",
      "role": "retrieval_axis",
      "ref": "mechanics/boundary-bridge/parts/tos-retrieval-axis/generated/tos_retrieval_axis_pack.min.json"
    },
    {
      "name": "federation_spine",
      "repo": "aoa-kag",
      "role": "federation_spine",
      "ref": "mechanics/boundary-bridge/parts/federation-spine/generated/federation_spine.min.json"
    }
  ],
  "surface_bindings": [
    {
      "surface_id": "AOA-K-0006",
      "surface_name": "cross-source-node-projection",
      "derived_kind": "node_projection",
      "derived_slot": "projections",
      "source_input": "aoa_techniques_kag_export"
    }
  ],
  "surface_id": "AOA-K-0006",
  "surface_name": "cross-source-node-projection",
  "projection_count": 1,
  "projections": [
    {
      "projection_id": "AOA-K-0006::AOA-T-0043::tos.source.thus-spoke-zarathustra.prologue",
      "primary_input": {
        "repo": "aoa-techniques",
        "export_ref": "aoa-techniques/generated/kag_export.min.json",
        "kind": "technique",
        "object_id": "AOA-T-0043"
      },
      "supporting_inputs": [
        {
          "repo": "Tree-of-Sophia",
          "export_ref": "Tree-of-Sophia/ToS/derived-exports/kag_export.min.json",
          "kind": "source_node",
          "object_id": "tos.source.thus-spoke-zarathustra.prologue"
        }
      ],
      "retrieval_axis_ref": "mechanics/boundary-bridge/parts/tos-retrieval-axis/generated/tos_retrieval_axis_pack.min.json",
      "axis_id": "AOA-K-0007::tos.source.thus-spoke-zarathustra.prologue",
      "federation_spine_ref": "mechanics/boundary-bridge/parts/federation-spine/generated/federation_spine.min.json",
      "projection_summary": "Pairs the multi-source primary-input provenance technique with the current Zarathustra prologue source node as a one-hop, non-identity projection for provenance-visible bridge work.",
      "non_identity_boundary": "The projection aligns an operational technique with a supporting ToS source node for downstream inspection without claiming identity, ontology merger, counterpart activation, or routing ownership."
    }
  ],
  "bounded_output_contract": {
    "source_trace_required": true,
    "source_replacement": "forbidden",
    "counterpart_activation": "forbidden",
    "graph_expansion": "forbidden",
    "routing_ownership": "forbidden"
  }
}
